Photography,What setting should be changed to control depth of field?,aperture,100
Photography,A lens with a fixed focal length is also known as a _____ lens?,prime,300
Photography,To convey motion in a photograph the shutter speed should be?,decreased,100
Photography,Aperture is expressed as a _____?,fraction,300
Photography,A camera without a mirror is known as a ______ camera?,mirrorless,200
Photography,______ refers to the camera sensors sensitivity to light?,ISO,200
Photography,A composition technique is known as the rule of _____?,thirds,200
Photography,The cameras process for determining the proper exposure is known as _____?,metering,500
Photography,The exposure triangle is comprised of shutter speed and aperture and _____?,ISO,100
